{
  "schemaVersion": "4.0",
  "policyId": "automation-000000000000",
  "projectId": "replace-me",
  "mode": "AUTO_LOCAL_TO_REVIEW",
  "commitPolicy": "MILESTONE_COMMITS",
  "pushPolicy": "NONE",
  "stopConditions": [
    "AUTOMATED_CHECKPOINTS_COMPLETE",
    "HUMAN_CHECKPOINT",
    "OWNER_DECISION",
    "BOUNDARY_CHANGE",
    "R3_OR_IRREVERSIBLE_ACTION",
    "ACTION_GUARD",
    "ENVIRONMENT_BLOCKED",
    "PUSH_CONFLICT",
    "USER_INTERRUPT"
  ],
  "coordination": {"requestedBackend": "AUTO", "resolvedBackend": "SERIAL", "observedCapabilities": [], "workerLimit": "HOST_CAPACITY_ONLY", "hostRequiresAuthorization": false, "authorizationGranted": false, "authorizationPromptRequired": false},
  "confirmation": {
    "actorId": "product-owner",
    "summary": "replace-with-canonical-policy-summary",
    "summarySha256": "replace-with-64-char-sha256",
    "record": "AUTOMATION_CONFIRMATION.json",
    "confirmedAt": "replace-with-date-time"
  }
}
